{
  "$schema": "https://json-schema.org/draft/2020-12/schema",
  "$id": "https://cosmic-vikings/ar-agent/contracts/approval-request.schema.json",
  "title": "ApprovalRequest",
  "description": "What ApprovalGateComponent emits to request human approval (§19). Carries the tier, the proposed action, and the SSO-attributable requester.",
  "x-contract-version": "1.0.0",
  "x-status": "draft",
  "x-since": "2026-07-06",
  "type": "object",
  "additionalProperties": false,
  "required": ["approval_id", "trace_id", "tenant", "action", "amount", "currency", "tier", "requested_by", "requested_at", "proposal", "contract_version"],
  "properties": {
    "approval_id": {"type": "string", "pattern": "^[0-9a-f]{8}-[0-9a-f]{4}-[0-9a-f]{4}-[0-9a-f]{4}-[0-9a-f]{12}$"},
    "trace_id": {"type": "string", "minLength": 1},
    "tenant": {"type": "string", "minLength": 1},
    "action": {"type": "string", "minLength": 1, "description": "e.g. gl.post, invoice.issue, refund.issue, write_off.issue."},
    "amount": {"type": "string", "pattern": "^-?\\d+\\.\\d{2}$", "description": "Signed; refunds/write-offs negative."},
    "currency": {"type": "string", "pattern": "^[A-Z]{3}$"},
    "tier": {"type": "string", "enum": ["read-only", "auto", "approval", "dual-control"], "description": "§19 tier. Financial mutations require ≥ approval."},
    "requested_by": {"type": "string", "minLength": 1, "description": "Keycloak sub of the requester (§13/§19)."},
    "requested_at": {"type": "string", "pattern": "^\\d{4}-\\d{2}-\\d{2}T\\d{2}:\\d{2}:\\d{2}Z$"},
    "proposal": {
      "type": "object",
      "additionalProperties": false,
      "required": ["operation", "target"],
      "properties": {
        "operation": {"type": "string", "minLength": 1, "description": "The proposed effect (e.g. post_payment, issue_invoice, issue_refund)."},
        "target": {"type": "string", "minLength": 1, "description": "The entity the action targets (e.g. invoice id, customer id)."},
        "amount": {"type": "string", "pattern": "^-?\\d+\\.\\d{2}$"},
        "currency": {"type": "string", "pattern": "^[A-Z]{3}$"},
        "details": {"type": "object", "description": "Free-form action-specific context; no PII/secrets (§16)."}
      }
    },
    "idempotency_key": {"type": "string", "pattern": "^ar-idem:[a-z_]+:[a-z0-9_-]+:[a-z0-9_-]+$", "description": "Replayed on the financial POST (§10)."},
    "expires_at": {"type": "string", "pattern": "^\\d{4}-\\d{2}-\\d{2}T\\d{2}:\\d{2}:\\d{2}Z$"},
    "approval_ref": {"type": "string", "pattern": "^ar-approval-[0-9a-f]{8}-[0-9a-f]{4}-[0-9a-f]{4}-[0-9a-f]{4}-[0-9a-f]{12}$", "description": "Assigned once issued; present on the resume path."},
    "second_approver_required": {"type": "boolean", "description": "True for dual-control tier (§19)."},
    "contract_version": {"type": "string", "pattern": "^\\d+\\.\\d+\\.\\d+$"}
  }
}